{
  "$schema": "http://json-schema.org/draft-07/schema#",
  "title": "TuningOutput",
  "type": "object",
  "required": ["tuning_cycle_id", "rules_analyzed", "recommendations", "rules_skipped"],
  "additionalProperties": false,
  "properties": {
    "tuning_cycle_id": {
      "type": "string",
      "pattern": "^\\d{4}-\\d{2}-\\d{2}T\\d{2}:\\d{2}:\\d{2}Z$"
    },
    "rules_analyzed": {"type": "integer", "minimum": 0},
    "recommendations": {
      "type": "array",
      "items": {
        "type": "object",
        "required": [
          "rule_id", "current_value", "recommended_value",
          "delta_pct", "direction", "confidence",
          "evidence", "expected_impact", "reasoning", "rollback_criteria"
        ],
        "additionalProperties": false,
        "properties": {
          "rule_id": {
            "type": "string",
            "enum": [
              "CREDENTIAL_STUFFING_MIN_401",
              "CAMPAIGN_OVERLAP_MINUTES",
              "SSH_BRUTE_FORCE_MIN_FAILURES",
              "SQL_INJECTION_MIN_REQUESTS",
              "DIRECTORY_TRAVERSAL_MIN_ATTEMPTS",
              "SSRF_MIN_REQUESTS"
            ]
          },
          "current_value": {"type": "integer", "minimum": 0},
          "recommended_value": {"type": "integer", "minimum": 0},
          "delta_pct": {"type": "integer", "minimum": -50, "maximum": 50},
          "direction": {"type": "string", "enum": ["raise", "lower", "hold"]},
          "confidence": {"type": "string", "enum": ["high", "medium", "low"]},
          "evidence": {
            "type": "object",
            "required": ["current_detections", "estimated_true_positives", "estimated_false_positives", "signal_distribution"],
            "properties": {
              "current_detections": {"type": "integer", "minimum": 0},
              "estimated_true_positives": {"type": "integer", "minimum": 0},
              "estimated_false_positives": {"type": "integer", "minimum": 0},
              "signal_distribution": {"type": "string", "minLength": 10}
            }
          },
          "expected_impact": {
            "type": "object",
            "required": ["expected_fp_reduction", "expected_fn_risk", "score_delta_estimate"],
            "properties": {
              "expected_fp_reduction": {"type": "integer"},
              "expected_fn_risk": {"type": "string", "enum": ["none", "low", "medium", "high"]},
              "score_delta_estimate": {"type": "string"}
            }
          },
          "reasoning": {"type": "string", "minLength": 20},
          "rollback_criteria": {"type": "string", "minLength": 10}
        }
      }
    },
    "rules_skipped": {
      "type": "array",
      "items": {
        "type": "object",
        "required": ["rule_id", "reason"],
        "properties": {
          "rule_id": {"type": "string"},
          "reason": {"type": "string", "minLength": 10}
        }
      }
    }
  }
}
